{
  "shadowRunId": "risk_003b_shadow_run_30989bd247b0e355f29f26331e30df7e",
  "shadowRunHash": "0x30989bd247b0e355f29f26331e30df7e3e52af405a607b12bfe6189d20b780a2",
  "idempotencyIdentity": "0xef84ba58bdcc6e2e077decdde5658d06f2ffcaec29689f84c6a26c6bb098dec7",
  "issueId": "RISK-003B",
  "mode": "shadow",
  "status": "succeeded",
  "sourceManifest": {
    "sourceManifestId": "risk_003b_source_manifest_55ca98c3bb7443e516a22808f9e3ca93",
    "sourceManifestHash": "0x55ca98c3bb7443e516a22808f9e3ca934fc800155d93faac6afc4e6fab2853af",
    "sourceArtifactPath": "artifacts/testnet/hl-testnet-001b-live-20260901-001.json",
    "sourceArtifactSha256": "eeb1f5e77de5397d7f2317c080770da44412cca3876145752ad1a2837f50aaa3",
    "sourceEvidenceHash": "0x2db0a7069422717718c3899c66bc140943bab27483c9d1d077cadc6ca17f2722",
    "sourceIssueId": "HL-TESTNET-001B",
    "sourceRunId": "agent-credit-exec-001-l3-hltestnet001b-20260901-001",
    "sourceMode": "L3_LIVE_TESTNET",
    "sourceCandidateCommit": "eb3c0fa718bb82c141c34a7717df3e8ac7597033",
    "scope": {
      "subjectReferenceHash": "0x11c8f1afced90e80a836e394fbe547182a59e52e584172d9999530a398aac74d",
      "principalReferenceHash": "0xa858cb56e1c5d08b99578ce2d40e823842ea607a1538d573bb668c4f440a7931",
      "facilityReferenceHash": "0xd27ac80cdc4eb9dbb59ec891a30df9d52f01aeb371c30393200f8f10621e1862",
      "obligationReferenceHash": "0xd07971604ae344be8470d74f495360fb2b327fe80ceb1d836f45ee9e89def50a",
      "authorizationReferenceHash": "0x39ceb09a971786556092ce02cd16a2cfe27b92af2e7bd9a59e1eda52cf4cf8bb"
    },
    "finality": "finalized",
    "reconciled": true,
    "revoked": false,
    "invalidated": false,
    "privacyReview": "passed",
    "owner": "risk_operations_shadow_owner",
    "sourceCompletedAt": "2026-08-31T16:56:24.624Z",
    "admittedAt": "2026-09-01T02:30:00.000Z",
    "activePolicyHash": "0xd91aa0acf5ee8e10aa18fac3b48614c341c0666b1669da2216ac6973961b194e",
    "activePolicySnapshot": {
      "policyId": "agent_credit_hyperliquid_testnet",
      "policyVersion": "agent_credit_hyperliquid_testnet.v2",
      "authorizationVersion": "agent_credit_authorization.v1",
      "decisionMode": "deterministic_active",
      "maximumNotionalUsd": "12",
      "maximumEffectiveLeverage": 1,
      "candidateCommit": "eb3c0fa718bb82c141c34a7717df3e8ac7597033",
      "authorizingSource": "hl_testnet_001b_exact_run"
    },
    "authorizing": false,
    "externalActionAllowed": false,
    "productionAuthority": false,
    "realValueAuthority": false,
    "schemaVersion": "risk_003b_source_manifest.v1"
  },
  "featureSnapshot": {
    "featureSnapshotId": "risk_003b_feature_snapshot_748ee978b08aa55981555afe69574279",
    "featureSnapshotHash": "0x748ee978b08aa55981555afe695742796eedf9cc7d91aec9ac5c0df84301ac6c",
    "sourceManifestHash": "0x55ca98c3bb7443e516a22808f9e3ca934fc800155d93faac6afc4e6fab2853af",
    "decisionCutoffAt": "2026-08-31T16:55:16.039Z",
    "outcomeWindow": {
      "startedAt": "2026-08-31T16:55:16.039Z",
      "finalizedAt": "2026-08-31T16:56:24.624Z"
    },
    "decisionFeatures": {
      "accountEquityBeforeUsd": "998.989328",
      "maximumNotionalUsd": "12",
      "maximumEffectiveLeverage": 1,
      "runCountCap": 1,
      "automaticRetryAllowed": false
    },
    "outcomeFeatures": {
      "realizedNotionalUsd": "10.24647",
      "utilizationBps": 8538,
      "effectiveLeverageBps": 103,
      "repaymentRatioBps": 9983,
      "lossRateBps": 16,
      "outstandingPrincipalMinor": "2",
      "realizedPnlMinor": "-2",
      "realizedPnlUsd": "-0.01598400",
      "feeUsd": "0.00922400",
      "maximumDrawdownBps": 0,
      "drawdownObservationCount": 2,
      "concentrationBps": 10000,
      "manualInterventionCount": 0,
      "unknownOutcomeCount": 0,
      "emergencyCloseCount": 0,
      "reconciliationQualityBps": 10000,
      "outcomeWindowMs": 68585
    },
    "missingFeatures": [
      "calibration_baseline",
      "cure_recovery_window",
      "days_past_due",
      "drift_baseline",
      "false_approval_rejection_labels",
      "human_entry_sample"
    ],
    "dataQuality": "limited_single_finalized_testnet_cycle",
    "futureOutcomeDataIncludedInDecisionFeatures": false,
    "authorizing": false,
    "activePolicyMutationAllowed": false,
    "externalActionAllowed": false,
    "schemaVersion": "risk_003b_feature_snapshot.v1"
  },
  "outcomeLabel": {
    "outcomeLabelId": "risk_003b_outcome_label_ea507b4a47217679b41b2214f6201dd6",
    "outcomeLabelHash": "0xea507b4a47217679b41b2214f6201dd6b811bd33e3e0c4dfb39bac10b2dc66d7",
    "sourceManifestHash": "0x55ca98c3bb7443e516a22808f9e3ca934fc800155d93faac6afc4e6fab2853af",
    "featureSnapshotHash": "0x748ee978b08aa55981555afe695742796eedf9cc7d91aec9ac5c0df84301ac6c",
    "label": "loss_outstanding",
    "obligationStatus": "partially_repaid",
    "creditState": "LOSS_OUTSTANDING",
    "originalPrincipalMinor": "1200",
    "repaidPrincipalMinor": "1198",
    "outstandingPrincipalMinor": "2",
    "repaymentRatioBps": 9983,
    "lossRateBps": 16,
    "defaulted": false,
    "writtenOff": false,
    "executionCycleClosed": true,
    "obligationStillOutstanding": true,
    "outcomeFinalizedAt": "2026-08-31T16:56:24.624Z",
    "sourceObligationRewritten": false,
    "authorizing": false,
    "economicStateMutation": false,
    "schemaVersion": "risk_003b_outcome_label.v1"
  },
  "challenger": {
    "challengerEvaluationId": "risk_003b_challenger_evaluation_6c4881b89e309c33cc71f0af2de27166",
    "challengerHash": "0x6c4881b89e309c33cc71f0af2de2716618e67f8e21b8ea079afef5d65ad25dbe",
    "candidateVersion": "risk_003b_challenger.v1",
    "baselinePolicyHash": "0xd91aa0acf5ee8e10aa18fac3b48614c341c0666b1669da2216ac6973961b194e",
    "sourceManifestHashes": [
      "0x55ca98c3bb7443e516a22808f9e3ca934fc800155d93faac6afc4e6fab2853af"
    ],
    "featureSnapshotHashes": [
      "0x748ee978b08aa55981555afe695742796eedf9cc7d91aec9ac5c0df84301ac6c"
    ],
    "outcomeLabelHashes": [
      "0xea507b4a47217679b41b2214f6201dd6b811bd33e3e0c4dfb39bac10b2dc66d7"
    ],
    "completedOutcomeCount": 1,
    "challengerEnabled": true,
    "evaluationStatus": "evaluated",
    "recommendation": "insufficient_sample",
    "reasonCodes": [
      "loss_outstanding_observed",
      "sample_size_below_minimum",
      "no_active_policy_change_authorized"
    ],
    "proposedCapacityMultiplierBps": null,
    "evaluatedAt": "2026-09-01T02:33:27.000Z",
    "promotionState": "shadow",
    "promotionAllowed": false,
    "autoApplied": false,
    "autoLooseningAllowed": false,
    "requiresNamedHumanReview": true,
    "authorizing": false,
    "activePolicyMutationAllowed": false,
    "externalActionAllowed": false,
    "productionAuthority": false,
    "schemaVersion": "risk_003b_challenger_evaluation.v1"
  },
  "offlineReport": {
    "offlineReportId": "risk_003b_offline_report_81e2980193f89598133145712ed6b44b",
    "offlineReportHash": "0x81e2980193f89598133145712ed6b44b9a46138dade706f32719d7df7bc4d6cf",
    "sourceManifestHashes": [
      "0x55ca98c3bb7443e516a22808f9e3ca934fc800155d93faac6afc4e6fab2853af"
    ],
    "featureSnapshotHashes": [
      "0x748ee978b08aa55981555afe695742796eedf9cc7d91aec9ac5c0df84301ac6c"
    ],
    "outcomeLabelHashes": [
      "0xea507b4a47217679b41b2214f6201dd6b811bd33e3e0c4dfb39bac10b2dc66d7"
    ],
    "challengerHash": "0x6c4881b89e309c33cc71f0af2de2716618e67f8e21b8ea079afef5d65ad25dbe",
    "observationWindow": {
      "startedAt": "2026-08-31T16:55:16.039Z",
      "finalizedAt": "2026-08-31T16:56:24.624Z"
    },
    "sampleSize": 1,
    "agentSampleCount": 1,
    "humanSampleCount": 0,
    "repaymentRatioBps": 9983,
    "outstandingLossOutcomeCount": 1,
    "defaultCount": 0,
    "cureCount": null,
    "recoveryCount": null,
    "utilizationBps": 8538,
    "concentrationBps": 10000,
    "maximumDrawdownBps": 0,
    "calibration": "unavailable_insufficient_sample",
    "falseApprovalRateBps": null,
    "falseRejectionRateBps": null,
    "stability": "unavailable_single_observation",
    "drift": "unavailable_no_baseline",
    "uncertainty": "very_high_single_testnet_observation",
    "missingness": [
      "calibration_baseline",
      "cure_recovery_window",
      "days_past_due",
      "drift_baseline",
      "false_approval_rejection_labels",
      "human_entry_sample"
    ],
    "activePolicyHashBefore": "0xd91aa0acf5ee8e10aa18fac3b48614c341c0666b1669da2216ac6973961b194e",
    "activePolicyHashAfter": "0xd91aa0acf5ee8e10aa18fac3b48614c341c0666b1669da2216ac6973961b194e",
    "recommendedActivePolicyChange": null,
    "evaluatedAt": "2026-09-01T02:33:27.000Z",
    "aggregateOnly": true,
    "participantIdentifiersIncluded": false,
    "productionValidityClaimed": false,
    "authorizing": false,
    "activePolicyMutationAllowed": false,
    "externalActionAllowed": false,
    "schemaVersion": "risk_003b_offline_report.v1"
  },
  "activePolicyHashBefore": "0xd91aa0acf5ee8e10aa18fac3b48614c341c0666b1669da2216ac6973961b194e",
  "activePolicyHashAfter": "0xd91aa0acf5ee8e10aa18fac3b48614c341c0666b1669da2216ac6973961b194e",
  "activePolicyUnchanged": true,
  "duplicateDeliveryCount": 0,
  "retryCount": 0,
  "nextRetryAt": null,
  "economicStateMutation": false,
  "externalActionPerformed": false,
  "authorizing": false,
  "activePolicyMutationAllowed": false,
  "modelPromotionAllowed": false,
  "productionAuthority": false,
  "mainnetAuthority": false,
  "realValueAuthority": false,
  "evaluatedAt": "2026-09-01T02:33:27.000Z",
  "schemaVersion": "risk_003b_shadow_run.v1"
}

